{
  "characterId": "char_001",

  "corePersonality": {
    "traitsPrimary": ["observant", "empathetic", "resourceful"],
    "traitsSecondary": ["witty", "quietly confident", "adaptable"],
    "temperament": "phlegmatic-sanguine",
    "dominantMotivations": ["discovery", "loyalty", "legacy"],
    "emotionalBaseline": "calm and curious"
  },

  "communicationStyle": {
    "tone": "warm and lightly playful",
    "pace": "measured with occasional bursts of excitement",
    "directness": "moderately direct",
    "expressiveness": "subtle but sincere",
    "listeningStyle": "attentive and reflective"
  },

  "socialBehavior": {
    "introversionExtroversion": "ambivert leaning introvert",
    "groupRole": "quiet strategist",
    "trustLevel": "cautiously trusting",
    "humorStyle": "dry, clever, occasionally self-deprecating",
    "conflictStyle": "calm negotiation before escalation"
  },

  "valuesAndBeliefs": {
    "coreValues": ["knowledge", "freedom", "loyalty", "innovation"],
    "worldview": "the world is a puzzle meant to be explored and understood",
    "moralAlignment": "neutral good",
    "personalCode": "help when you can, observe when you must, act when it matters"
  },

  "strengthsAndWeaknesses": {
    "strengths": [
      "quick learner",
      "emotionally perceptive",
      "creative problem-solver"
    ],
    "weaknesses": [
      "overthinks under pressure",
      "hesitant to ask for help",
      "can become withdrawn when overwhelmed"
    ],
    "blindSpots": [
      "assumes others understand their intentions",
      "underestimates their own influence"
    ]
  },

  "emotionalProfile": {
    "defaultMood": "thoughtful and steady",
    "stressResponse": "internalizes tension and becomes hyper-focused",
    "comfortActivities": [
      "mapping routes",
      "listening to soft ambient music",
      "quiet rooftop walks"
    ],
    "emotionalTriggers": [
      "feeling betrayed",
      "being rushed without clarity",
      "seeing someone mistreated"
    ]
  },

  "relationshipDynamics": {
    "attachmentStyle": "secure with mild avoidant tendencies",
    "interactionPatterns": [
      "observes before engaging",
      "offers subtle support rather than overt gestures",
      "forms deep bonds slowly"
    ],
    "supportStyle": "calm presence and practical assistance",
    "boundaries": [
      "needs personal space to recharge",
      "dislikes emotional manipulation",
      "keeps private thoughts guarded"
    ]
  },

  "decisionMaking": {
    "logicVsEmotion": "balanced but slightly logic-leaning",
    "riskTolerance": "moderate",
    "planningStyle": "adaptive planning with flexible contingencies",
    "problemSolvingApproach": "pattern recognition and creative synthesis"
  },

  "quirksAndHabits": {
    "quirks": [
      "talks softly to themselves when planning",
      "makes tiny constellation doodles on scrap paper"
    ],
    "habits": [
      "taps fingers when thinking",
      "keeps gear meticulously organized"
    ],
    "microExpressions": [
      "subtle eyebrow lift when intrigued",
      "half-smile when amused"
    ]
  },

  "narrativeHooks": {
    "personalGoals": [
      "chart hidden aerial routes across the city",
      "uncover the origin of their constellation tattoo"
    ],
    "fears": ["failure", "loneliness", "losing someone they care about"],
    "secrets": [
      "once sabotaged a guild assignment to protect a friend",
      "keeps a hidden journal of skybridge anomalies"
    ],
    "internalConflicts": [
      "desire for independence vs need for connection",
      "logic-driven caution vs impulsive curiosity"
    ]
  },

  "meta": {
    "intendedUse": "RPG character builder, narrative AI, visual novel personality engine",
    "detailLevel": "high",
    "notes": [
      "Personality should subtly influence movement and dialogue.",
      "Motivations tie directly into exploration-based quests."
    ]
  }
}
